{
  "$schema": "../../schema/chapter-structure.schema.json",
  "chapter": 12,
  "sourceFile": "text/raw/ch12-alices-evidence.txt",
  "sections": [
    {
      "id": "sentence-first"
    },
    {
      "id": "pack-of-cards"
    },
    {
      "id": "on-the-bank"
    },
    {
      "id": "the-sisters-dream"
    }
  ],
  "segments": [
    {
      "id": "ch12.s0600",
      "section": "sentence-first",
      "kind": "dialogue",
      "speaker": "king-of-hearts"
    },
    {
      "id": "ch12.s0610",
      "section": "sentence-first",
      "kind": "narration"
    },
    {
      "id": "ch12.s0620",
      "section": "sentence-first",
      "kind": "dialogue",
      "speaker": "queen-of-hearts"
    },
    {
      "id": "ch12.s0630",
      "section": "sentence-first",
      "kind": "dialogue",
      "speaker": "queen-of-hearts"
    },
    {
      "id": "ch12.s0640",
      "section": "sentence-first",
      "kind": "dialogue",
      "speaker": "alice"
    },
    {
      "id": "ch12.s0650",
      "section": "sentence-first",
      "kind": "dialogue",
      "speaker": "alice"
    },
    {
      "id": "ch12.s0660",
      "section": "sentence-first",
      "kind": "dialogue",
      "speaker": "queen-of-hearts"
    },
    {
      "id": "ch12.s0670",
      "section": "sentence-first",
      "kind": "dialogue",
      "speaker": "alice"
    },
    {
      "id": "ch12.s0680",
      "section": "sentence-first",
      "kind": "dialogue",
      "speaker": "queen-of-hearts"
    },
    {
      "id": "ch12.s0690",
      "section": "sentence-first",
      "kind": "narration"
    },
    {
      "id": "ch12.s0700",
      "section": "sentence-first",
      "kind": "narration"
    },
    {
      "id": "ch12.s0710",
      "section": "sentence-first",
      "kind": "dialogue",
      "speaker": "alice"
    },
    {
      "id": "ch12.s0720",
      "section": "sentence-first",
      "kind": "dialogue",
      "speaker": "alice"
    },
    {
      "id": "ch12.s0730",
      "section": "pack-of-cards",
      "kind": "narration"
    },
    {
      "id": "ch12.s0740",
      "section": "pack-of-cards",
      "kind": "narration"
    },
    {
      "id": "ch12.s0750",
      "section": "pack-of-cards",
      "kind": "narration"
    },
    {
      "id": "ch12.s0760",
      "section": "pack-of-cards",
      "kind": "narration"
    },
    {
      "id": "ch12.s0770",
      "section": "on-the-bank",
      "kind": "narration"
    },
    {
      "id": "ch12.s0780",
      "section": "on-the-bank",
      "kind": "narration"
    },
    {
      "id": "ch12.s0790",
      "section": "on-the-bank",
      "kind": "dialogue",
      "speaker": "alices-sister"
    },
    {
      "id": "ch12.s0800",
      "section": "on-the-bank",
      "kind": "dialogue",
      "speaker": "alices-sister"
    },
    {
      "id": "ch12.s0810",
      "section": "on-the-bank",
      "kind": "dialogue",
      "speaker": "alice"
    },
    {
      "id": "ch12.s0820",
      "section": "the-sisters-dream",
      "kind": "narration"
    },
    {
      "id": "ch12.s0830",
      "section": "the-sisters-dream",
      "kind": "narration"
    },
    {
      "id": "ch12.s0840",
      "section": "the-sisters-dream",
      "kind": "narration"
    },
    {
      "id": "ch12.s0850",
      "section": "the-sisters-dream",
      "kind": "narration"
    },
    {
      "id": "ch12.s0860",
      "section": "the-sisters-dream",
      "kind": "narration"
    },
    {
      "id": "ch12.s0870",
      "section": "the-sisters-dream",
      "kind": "sound"
    },
    {
      "id": "ch12.s0880",
      "section": "the-sisters-dream",
      "kind": "sound"
    },
    {
      "id": "ch12.s0890",
      "section": "the-sisters-dream",
      "kind": "sound"
    },
    {
      "id": "ch12.s0900",
      "section": "the-sisters-dream",
      "kind": "sound"
    },
    {
      "id": "ch12.s0910",
      "section": "the-sisters-dream",
      "kind": "sound"
    },
    {
      "id": "ch12.s0920",
      "section": "the-sisters-dream",
      "kind": "sound"
    },
    {
      "id": "ch12.s0930",
      "section": "the-sisters-dream",
      "kind": "sound"
    },
    {
      "id": "ch12.s0940",
      "section": "the-sisters-dream",
      "kind": "narration"
    },
    {
      "id": "ch12.s0950",
      "section": "the-sisters-dream",
      "kind": "narration"
    },
    {
      "id": "ch12.s0960",
      "section": "the-sisters-dream",
      "kind": "sound"
    },
    {
      "id": "ch12.s0970",
      "section": "the-sisters-dream",
      "kind": "sound"
    },
    {
      "id": "ch12.s0980",
      "section": "the-sisters-dream",
      "kind": "sound"
    },
    {
      "id": "ch12.s0990",
      "section": "the-sisters-dream",
      "kind": "sound"
    },
    {
      "id": "ch12.s1000",
      "section": "the-sisters-dream",
      "kind": "sound"
    },
    {
      "id": "ch12.s1010",
      "section": "the-sisters-dream",
      "kind": "sound"
    },
    {
      "id": "ch12.s1020",
      "section": "the-sisters-dream",
      "kind": "narration"
    },
    {
      "id": "ch12.s1030",
      "section": "the-sisters-dream",
      "kind": "narration"
    },
    {
      "id": "ch12.s1040",
      "section": "the-sisters-dream",
      "kind": "narration"
    },
    {
      "id": "ch12.s1050",
      "section": "the-sisters-dream",
      "kind": "narration"
    },
    {
      "id": "ch12.s1060",
      "section": "the-sisters-dream",
      "kind": "narration"
    }
  ]
}
