{
  "$schema": "../../schema/chapter-structure.schema.json",
  "chapter": 5,
  "sourceFile": "text/raw/ch05-advice-from-a-caterpillar.txt",
  "sections": [
    {
      "id": "who-are-you"
    },
    {
      "id": "the-mushroom"
    },
    {
      "id": "serpent"
    }
  ],
  "segments": [
    {
      "id": "ch05.s0010",
      "section": "who-are-you",
      "kind": "narration"
    },
    {
      "id": "ch05.s0020",
      "section": "who-are-you",
      "kind": "narration"
    },
    {
      "id": "ch05.s0030",
      "section": "who-are-you",
      "kind": "dialogue",
      "speaker": "caterpillar"
    },
    {
      "id": "ch05.s0040",
      "section": "who-are-you",
      "kind": "narration"
    },
    {
      "id": "ch05.s0050",
      "section": "who-are-you",
      "kind": "dialogue",
      "speaker": "alice"
    },
    {
      "id": "ch05.s0060",
      "section": "who-are-you",
      "kind": "dialogue",
      "speaker": "alice"
    },
    {
      "id": "ch05.s0070",
      "section": "who-are-you",
      "kind": "dialogue",
      "speaker": "alice"
    },
    {
      "id": "ch05.s0080",
      "section": "who-are-you",
      "kind": "dialogue",
      "speaker": "caterpillar"
    },
    {
      "id": "ch05.s0090",
      "section": "who-are-you",
      "kind": "dialogue",
      "speaker": "caterpillar"
    },
    {
      "id": "ch05.s0100",
      "section": "who-are-you",
      "kind": "dialogue",
      "speaker": "alice"
    },
    {
      "id": "ch05.s0110",
      "section": "who-are-you",
      "kind": "dialogue",
      "speaker": "caterpillar"
    },
    {
      "id": "ch05.s0120",
      "section": "who-are-you",
      "kind": "dialogue",
      "speaker": "alice"
    },
    {
      "id": "ch05.s0130",
      "section": "who-are-you",
      "kind": "dialogue",
      "speaker": "caterpillar"
    },
    {
      "id": "ch05.s0140",
      "section": "who-are-you",
      "kind": "narration"
    },
    {
      "id": "ch05.s0150",
      "section": "who-are-you",
      "kind": "dialogue",
      "speaker": "caterpillar"
    },
    {
      "id": "ch05.s0160",
      "section": "who-are-you",
      "kind": "dialogue",
      "speaker": "alice"
    },
    {
      "id": "ch05.s0170",
      "section": "who-are-you",
      "kind": "dialogue",
      "speaker": "alice"
    },
    {
      "id": "ch05.s0180",
      "section": "who-are-you",
      "kind": "dialogue",
      "speaker": "caterpillar"
    },
    {
      "id": "ch05.s0190",
      "section": "the-mushroom",
      "kind": "dialogue",
      "speaker": "caterpillar"
    },
    {
      "id": "ch05.s0200",
      "section": "the-mushroom",
      "kind": "dialogue",
      "speaker": "alice"
    },
    {
      "id": "ch05.s0210",
      "section": "the-mushroom",
      "kind": "dialogue",
      "speaker": "alice"
    },
    {
      "id": "ch05.s0220",
      "section": "the-mushroom",
      "kind": "dialogue",
      "speaker": "alice"
    },
    {
      "id": "ch05.s0230",
      "section": "the-mushroom",
      "kind": "dialogue",
      "speaker": "alice"
    },
    {
      "id": "ch05.s0240",
      "section": "the-mushroom",
      "kind": "dialogue",
      "speaker": "caterpillar"
    },
    {
      "id": "ch05.s0250",
      "section": "the-mushroom",
      "kind": "narration"
    },
    {
      "id": "ch05.s0260",
      "section": "the-mushroom",
      "kind": "narration"
    },
    {
      "id": "ch05.s0270",
      "section": "the-mushroom",
      "kind": "narration"
    },
    {
      "id": "ch05.s0280",
      "section": "the-mushroom",
      "kind": "dialogue",
      "speaker": "caterpillar"
    },
    {
      "id": "ch05.s0290",
      "section": "the-mushroom",
      "kind": "thought",
      "speaker": "alice"
    },
    {
      "id": "ch05.s0300",
      "section": "the-mushroom",
      "kind": "thought",
      "speaker": "alice"
    },
    {
      "id": "ch05.s0310",
      "section": "the-mushroom",
      "kind": "dialogue",
      "speaker": "caterpillar"
    },
    {
      "id": "ch05.s0320",
      "section": "the-mushroom",
      "kind": "narration"
    },
    {
      "id": "ch05.s0330",
      "section": "the-mushroom",
      "kind": "narration"
    },
    {
      "id": "ch05.s0340",
      "section": "the-mushroom",
      "kind": "narration"
    },
    {
      "id": "ch05.s0350",
      "section": "the-mushroom",
      "kind": "narration"
    },
    {
      "id": "ch05.s0360",
      "section": "the-mushroom",
      "kind": "dialogue",
      "speaker": "alice"
    },
    {
      "id": "ch05.s0370",
      "section": "the-mushroom",
      "kind": "narration"
    },
    {
      "id": "ch05.s0380",
      "section": "the-mushroom",
      "kind": "narration"
    },
    {
      "id": "ch05.s0390",
      "section": "the-mushroom",
      "kind": "narration"
    },
    {
      "id": "ch05.s0400",
      "section": "the-mushroom",
      "kind": "narration"
    },
    {
      "id": "ch05.s0410",
      "section": "the-mushroom",
      "kind": "narration"
    },
    {
      "id": "ch05.s0420",
      "section": "the-mushroom",
      "kind": "narration"
    },
    {
      "id": "ch05.s0430",
      "section": "serpent",
      "kind": "dialogue",
      "speaker": "alice"
    },
    {
      "id": "ch05.s0440",
      "section": "serpent",
      "kind": "narration"
    },
    {
      "id": "ch05.s0450",
      "section": "serpent",
      "kind": "narration"
    },
    {
      "id": "ch05.s0460",
      "section": "serpent",
      "kind": "narration"
    },
    {
      "id": "ch05.s0470",
      "section": "serpent",
      "kind": "narration"
    },
    {
      "id": "ch05.s0480",
      "section": "serpent",
      "kind": "dialogue",
      "speaker": "alice"
    },
    {
      "id": "ch05.s0490",
      "section": "serpent",
      "kind": "dialogue",
      "speaker": "alice"
    },
    {
      "id": "ch05.s0500",
      "section": "serpent",
      "kind": "narration"
    },
    {
      "id": "ch05.s0510",
      "section": "serpent",
      "kind": "narration"
    },
    {
      "id": "ch05.s0520",
      "section": "serpent",
      "kind": "narration"
    },
    {
      "id": "ch05.s0530",
      "section": "serpent",
      "kind": "narration"
    },
    {
      "id": "ch05.s0540",
      "section": "serpent",
      "kind": "dialogue",
      "speaker": "pigeon"
    },
    {
      "id": "ch05.s0550",
      "section": "serpent",
      "kind": "dialogue",
      "speaker": "alice"
    },
    {
      "id": "ch05.s0560",
      "section": "serpent",
      "kind": "dialogue",
      "speaker": "alice"
    },
    {
      "id": "ch05.s0570",
      "section": "serpent",
      "kind": "dialogue",
      "speaker": "pigeon"
    },
    {
      "id": "ch05.s0580",
      "section": "serpent",
      "kind": "dialogue",
      "speaker": "pigeon"
    },
    {
      "id": "ch05.s0590",
      "section": "serpent",
      "kind": "dialogue",
      "speaker": "pigeon"
    },
    {
      "id": "ch05.s0600",
      "section": "serpent",
      "kind": "dialogue",
      "speaker": "pigeon"
    },
    {
      "id": "ch05.s0610",
      "section": "serpent",
      "kind": "dialogue",
      "speaker": "pigeon"
    },
    {
      "id": "ch05.s0620",
      "section": "serpent",
      "kind": "dialogue",
      "speaker": "alice"
    },
    {
      "id": "ch05.s0630",
      "section": "serpent",
      "kind": "dialogue",
      "speaker": "pigeon"
    },
    {
      "id": "ch05.s0640",
      "section": "serpent",
      "kind": "dialogue",
      "speaker": "alice"
    },
    {
      "id": "ch05.s0650",
      "section": "serpent",
      "kind": "dialogue",
      "speaker": "pigeon"
    },
    {
      "id": "ch05.s0660",
      "section": "serpent",
      "kind": "dialogue",
      "speaker": "pigeon"
    },
    {
      "id": "ch05.s0670",
      "section": "serpent",
      "kind": "dialogue",
      "speaker": "pigeon"
    },
    {
      "id": "ch05.s0680",
      "section": "serpent",
      "kind": "narration"
    },
    {
      "id": "ch05.s0690",
      "section": "serpent",
      "kind": "narration"
    },
    {
      "id": "ch05.s0700",
      "section": "serpent",
      "kind": "narration"
    },
    {
      "id": "ch05.s0710",
      "section": "serpent",
      "kind": "narration"
    },
    {
      "id": "ch05.s0720",
      "section": "serpent",
      "kind": "narration"
    }
  ]
}
